{"$schema":"./schemas/catalog-index-v1.schema.json","apiVersion":"catalog.astronomer.dev/v1alpha1","applications":[{"artifact":{"chart":"cert-manager","repository":"jetstack","type":"helm","version":"v1.21.1"},"category":"security","compatibility":{"kubernetes":">=1.31.0 <1.36.0"},"defaultEnabled":false,"documentation":"https://cert-manager.io/docs/installation/helm/","home":"https://cert-manager.io/","icon":"https://raw.githubusercontent.com/cert-manager/cert-manager/master/logo/logo-small.png","keywords":["tls","certificates","letsencrypt"],"lifecycle":{"install":true,"rollback":true,"uninstall":true,"upgrade":true},"name":"cert-manager","privileged":true,"resources":{"profile":"medium"},"slug":"cert-manager","storage":{"required":false},"summary":"Certificate issuance and renewal for Kubernetes workloads.","supportTier":"upstream","ui":{"configurationMode":"schema-and-yaml","featured":true,"sections":["crds","webhook","approver","resources"]}},{"artifact":{"chart":"cloudnative-pg","repository":"cnpg","type":"helm","version":"0.29.0"},"category":"database","compatibility":{"kubernetes":">=1.31.0 <1.36.0"},"defaultEnabled":false,"description":"Operate PostgreSQL clusters with automated failover, rolling updates, backups, recovery, and declarative configuration.","documentation":"https://cloudnative-pg.io/documentation/current/installation_upgrade/","home":"https://cloudnative-pg.io/","icon":"https://cdn.simpleicons.org/postgresql/4169E1","keywords":["postgresql","database","operator","ha","backup"],"lifecycle":{"install":true,"rollback":false,"uninstall":true,"upgrade":true},"name":"CloudNativePG","privileged":true,"resources":{"profile":"medium"},"slug":"cloudnative-pg","storage":{"managedClustersRequireStorage":true,"required":false},"summary":"Kubernetes operator for highly available PostgreSQL clusters.","supportTier":"upstream","ui":{"configurationMode":"schema-and-yaml","featured":true,"sections":["operator","monitoring","webhook","resources"]}},{"artifact":{"chart":"constellation","repository":"astronomer-first-party","type":"helm","version":"0.2.0"},"category":"security","compatibility":{"kubernetes":">=1.27.0 <1.36.0"},"defaultEnabled":false,"description":"Discover workloads, analyze images with Trivy and Grype, generate SBOM inventory with Syft, visualize network flows, enforce admission and runtime policy, and operate compliance programs from one highly available control plane.","documentation":"https://github.com/alphabravo-oss/constellation/tree/main/docs","home":"https://github.com/alphabravo-oss/constellation","icon":"https://raw.githubusercontent.com/alphabravo-oss/constellation/main/frontend/public/icon.svg","keywords":["security","runtime","admission","trivy","grype","syft","sbom","compliance","network"],"lifecycle":{"install":true,"rollback":true,"uninstall":true,"upgrade":true},"name":"Constellation","privileged":true,"resources":{"notes":"Runtime agents run on every node; scanners and PostgreSQL should be sized for image volume and retention.","profile":"large"},"slug":"constellation","storage":{"recommended":"20Gi database plus 8Gi scanner cache","required":true,"thinProvisioning":true},"summary":"Astronomer first-party Kubernetes and container security platform.","supportTier":"astronomer","ui":{"configurationMode":"schema-and-yaml","featured":true,"sections":["high-availability","scanning","runtime","admission","ingress","postgres","tls","bootstrap"]}},{"artifact":{"chart":"external-dns","repository":"external-dns","type":"helm","version":"1.21.1"},"category":"networking","compatibility":{"kubernetes":">=1.31.0 <1.36.0"},"defaultEnabled":false,"description":"Automate DNS records for exposed Kubernetes workloads using supported public and private DNS providers.","documentation":"https://kubernetes-sigs.github.io/external-dns/latest/docs/","home":"https://kubernetes-sigs.github.io/external-dns/","icon":"https://raw.githubusercontent.com/kubernetes/kubernetes/master/logo/logo.svg","keywords":["dns","route53","cloudflare","azure-dns","google-dns"],"lifecycle":{"install":true,"rollback":true,"uninstall":true,"upgrade":true},"name":"ExternalDNS","privileged":true,"resources":{"profile":"small"},"slug":"external-dns","storage":{"required":false},"summary":"Synchronize Kubernetes Services and routes with DNS providers.","supportTier":"upstream","ui":{"configurationMode":"schema-and-yaml","featured":true,"sections":["provider","sources","domain-filters","policy","resources"]}},{"artifact":{"chart":"external-secrets","repository":"external-secrets","type":"helm","version":"2.9.0"},"category":"security","compatibility":{"kubernetes":">=1.31.0 <1.36.0"},"defaultEnabled":false,"description":"Connect Kubernetes workloads to AWS Secrets Manager, Azure Key Vault, Google Secret Manager, Vault, and other supported providers.","documentation":"https://external-secrets.io/latest/introduction/getting-started/","home":"https://external-secrets.io/","icon":"https://raw.githubusercontent.com/external-secrets/external-secrets/main/assets/eso-round-logo.svg","keywords":["secrets","vault","aws","azure","gcp"],"lifecycle":{"install":true,"rollback":true,"uninstall":true,"upgrade":true},"name":"External Secrets Operator","privileged":true,"resources":{"profile":"medium"},"slug":"external-secrets","storage":{"required":false},"summary":"Synchronize secrets from external providers into Kubernetes.","supportTier":"upstream","ui":{"configurationMode":"schema-and-yaml","featured":true,"sections":["crds","webhook","cert-controller","resources"]}},{"artifact":{"chart":"fluent-bit","repository":"fluent","type":"helm","version":"0.58.1"},"category":"logging","compatibility":{"kubernetes":">=1.31.0 <1.36.0"},"defaultEnabled":false,"description":"Collect, enrich, and route node and container logs to supported logging backends.","documentation":"https://docs.fluentbit.io/manual/installation/kubernetes","home":"https://fluentbit.io/","icon":"https://cdn.simpleicons.org/fluentbit/49BDA5","keywords":["logs","forwarder","daemonset","observability"],"lifecycle":{"install":true,"rollback":true,"uninstall":true,"upgrade":true},"name":"Fluent Bit","privileged":true,"resources":{"profile":"small"},"slug":"fluent-bit","storage":{"required":false},"summary":"Lightweight Kubernetes log processor and forwarder.","supportTier":"upstream","ui":{"configurationMode":"schema-and-yaml","featured":true,"sections":["inputs","filters","outputs","buffers","resources"]}},{"artifact":{"chart":"gatekeeper","repository":"gatekeeper","type":"helm","version":"3.23.0"},"category":"security","compatibility":{"kubernetes":">=1.31.0 <1.36.0"},"defaultEnabled":false,"description":"Enforce reusable constraints on Kubernetes resources and report policy violations.","documentation":"https://open-policy-agent.github.io/gatekeeper/website/docs/install/","home":"https://open-policy-agent.github.io/gatekeeper/website/","icon":"https://cdn.simpleicons.org/openpolicyagent/7D9199","keywords":["opa","policy","admission","compliance"],"lifecycle":{"install":true,"rollback":true,"uninstall":true,"upgrade":true},"name":"OPA Gatekeeper","privileged":true,"resources":{"profile":"medium"},"slug":"gatekeeper","storage":{"required":false},"summary":"Admission control and policy enforcement powered by Open Policy Agent.","supportTier":"upstream","ui":{"configurationMode":"schema-and-yaml","featured":true,"sections":["admission","audit","mutation","resources"]}},{"artifact":{"chart":"grafana","repository":"grafana","type":"helm","version":"10.5.15"},"category":"monitoring","compatibility":{"kubernetes":">=1.31.0 <1.36.0"},"defaultEnabled":false,"documentation":"https://github.com/grafana/helm-charts/tree/main/charts/grafana","home":"https://grafana.com/oss/grafana/","icon":"https://cdn.simpleicons.org/grafana/F46800","keywords":["dashboards","visualization"],"lifecycle":{"install":true,"rollback":true,"uninstall":true,"upgrade":true},"name":"Grafana","privileged":false,"resources":{"profile":"medium"},"slug":"grafana","storage":{"recommended":"10Gi","required":true},"summary":"Dashboards and visualization for metrics, logs, and traces.","supportTier":"upstream","ui":{"configurationMode":"schema-and-yaml","featured":true,"sections":["general","authentication","datasources","persistence","resources"]}},{"artifact":{"chart":"ingress-nginx","repository":"ingress-nginx","type":"helm","version":"4.15.1"},"category":"networking","compatibility":{"kubernetes":">=1.31.0 <1.36.0"},"defaultEnabled":false,"documentation":"https://kubernetes.github.io/ingress-nginx/deploy/","home":"https://kubernetes.github.io/ingress-nginx/","icon":"https://cdn.simpleicons.org/nginx/009639","keywords":["ingress","nginx","load-balancer"],"lifecycle":{"install":true,"rollback":true,"uninstall":true,"upgrade":true},"name":"Ingress NGINX","privileged":true,"resources":{"profile":"medium"},"slug":"ingress-nginx","storage":{"required":false},"summary":"NGINX-based Kubernetes ingress controller.","supportTier":"upstream","ui":{"configurationMode":"schema-and-yaml","featured":true,"sections":["controller","service","tls","autoscaling","resources"]}},{"artifact":{"chart":"keda","repository":"kedacore","type":"helm","version":"2.20.2"},"category":"other","compatibility":{"kubernetes":">=1.31.0 <1.36.0"},"defaultEnabled":false,"description":"Scale Deployments, Jobs, and custom workloads from external event and queue metrics.","documentation":"https://keda.sh/docs/deploy/","home":"https://keda.sh/","icon":"https://raw.githubusercontent.com/kedacore/keda/main/images/keda-logo-transparent.png","keywords":["autoscaling","events","queues","hpa"],"lifecycle":{"install":true,"rollback":true,"uninstall":true,"upgrade":true},"name":"KEDA","privileged":true,"resources":{"profile":"medium"},"slug":"keda","storage":{"required":false},"summary":"Event-driven autoscaling for Kubernetes workloads.","supportTier":"upstream","ui":{"configurationMode":"schema-and-yaml","featured":true,"sections":["operator","metrics-server","webhooks",